content,estimate
全国实际在运营降至家后续处置难度大新冠肺炎疫情给互联网金融和网络借贷整治工作带来新的挑战剩余在营机构三降工作进展缓慢停业机构退而不清退而难清问题突出转型面临许多困难全国实际在运营降至家后续处置难度大
英国新冠画面首度公开有些医生没有全身防护服只能用一次性罩衣围裙这样的防备真的让人担心英国每周从中国运约吨医疗物资青年湖南的微博视频
原油原油中线来看已经下跌空间不大唯一问题就是新冠疫情下需求如何起来一味靠减产来刺激原油反弹真正健康的反弹是靠需求拉动目前看工业品走通缩路径美原油前低后高美原油远月过高后期有补跌风险布油未来一段时间会在-之间做震荡向上向下过此区间都是诱多诱空
建议注射消毒液杀死病毒特朗普改口我不是医生特朗普称并不推荐美国人注射消毒液特朗普日暗示也许可以注射消毒液来抵御新冠病毒生产家用消毒剂的利洁时公司和高乐氏公司日相继发表声明警告用户不要使用消毒剂作为治疗剂特朗普日表示他前一天的讲话只是表达讽刺并不是要
华春莹发推中国已向美国提供超过亿个口罩够每个美国人分个近来新冠疫情在美国快速蔓延美国的医护人员和普通民众也面临医用防护物资缺乏的难题月日外交部发言人华春莹发推特称截至月日中国已向美国提供了超过亿个口罩这意味着每个美国人能分到个口罩此外中国
张文宏科普疫苗接种网络上有很多疫苗的宣传老百姓有没有必要都应该接种呢上海市新冠肺炎医疗救治专家组组长复旦大学附属华山医院感染科主任张文宏表示疫苗是非常复杂的问题社会有一个特点不发生风险的时候大家其实不会主动做让你主动采取一件对健康有意义的事情而风险在
张文宏谈中西医结合抗疫有了中医思想我们能走得更远更好月日下午张文宏在中医药在新冠肺炎防治中的作用与传承创新发展研讨会上表示在上海的新冠肺炎救治工作中充分贯彻了中西医结合中西医并重在他看来中医不应拒绝科学的方法西医也不该拒绝中医药的融入张文宏说中西
区块链服务网络正式商用启动据人民网日区块链服务网络全球商用启动大会在北京隆重召开国家信息中心主任刘宇南表示热烈祝贺区块链服务网络商用正式启动目前区块链服务网络各项功能已趋于稳定同时还催生了公益慈善物品追溯电子发票等一批创新应用并已在今
区块链服务网络正式商用启动据人民网日区块链服务网络全球商用启动大会在北京隆重召开国家信息中心主任刘宇南表示热烈祝贺区块链服务网络商用正式启动目前区块链服务网络各项功能已趋于稳定同时还催生了公益慈善物品追溯电子发票等一批创新应用并已在今
年三亚亚沙会-三亚亚沙会办好亚沙会让三亚更具吸引力近日亚沙会组委会工作委员会副秘书长三亚市政府副秘书长叶凯中接受记者采访时表示今年因为新冠疫情很多国际赛事都不得不延期或取消而亚沙会却依然可以如期举行我们深知在这样一个特殊的时间节点上亚沙会的如期举
杜兰特从新冠肺炎中痊愈杜兰特的经纪人里奇-克莱曼近日谈到了的恢复情况他说杜兰特一开始被检测感染了病毒之后他们都感到非常恐怖但杜兰特始终没有出现过症状目前已经痊愈微博篮球感恩季体育迷失恋天
新加坡将为经济重启做大规模新冠抗体检测新加坡贸工部长陈振声月日接受彭博社采访时表示新加坡计划能够在大约一个月的时间内逐步重新开放经济为此将对整个人口进行大规模测试同时采取更多的安全隔离措施截至月日新加坡新冠肺炎确诊总数达到例其中超过是住在宿
美众议院设立机构审查特朗普政府抗疫工作参考消息网月日报道据路透社华盛顿月日报道民主党主导的美国国会众议院于当地时间周四批准成立一个特别调查委员会负责审查联邦政府的疫情应对工作报道称虽然遭到共和党人的反对但众议院当天仍通过了这项法案该委员会将被赋予
从近万降至清零回顾重症患者转危为安的动人瞬间据长江日报月日武汉最后一例新冠重症患者治愈实现清零从月中旬重症患者最高峰时的近万例到月日下降至两位数再到日清零武汉市湖北省乃至全国付出了艰苦努力一起回顾一个个患者与死神搏斗后的动人瞬间
张文宏今天是中医药走向现代化的良好开始月日中医药在新冠肺炎防治中的作用与传承创新发展研讨会上张文宏表示很欣喜地看到很多中医药科学家已经开始做有效成分的分离纯化包括做计算机辅助分析对有效小分子化合物提纯如果能得出结果成就将不亚于屠呦呦发现青蒿素的成就相信中
海外抗疫日记英国航空增派中国航班运医疗物资当地时间日英国航空公司宣布从月起往返中英的航班数将从目前的每周架次增至每周架次以确保英国每周从中国运约吨医疗物资包括防护用品呼吸机等此前该公司已重启因疫情暂停的中英直航并史上首次将其所有客运航班改为货
美国国土安全部公布惊人发现阳光能在数分钟内杀死新冠病毒美国东部时间月日晚间在白宫举行的疫情新闻发布会上美国国土安全部科学和技术顾问威廉·布莱恩公布了国家生物防御分析和对策中心的一项惊人研究结论阳光可以在数分钟内杀死新冠病毒因为紫外线辐射能破坏病毒的遗传物质
美国海军基德号驱逐舰暴发疫情当地时间日据美国有线电视新闻网消息美国海军基德号驱逐舰暴发新冠肺炎疫情已有人确诊该舰被派往加勒比东太平洋地区执行任务报道称海军医疗小组正在进行接触者追踪央视记者徐德智
有一个山村来的丫鬟为了怀上龙少爷的小孩想尽办法靠近龙少爷最后把他目垂了如愿当上龙家少奶奶纽约公交地铁位员工死于新冠肺炎穿太宗时期的服饰演奏大话西游追剧喵喵匠的微博视频
同样是日记她却看哭无数人病毒无情夺走了男友的生命女孩记录下最后的点点滴滴两个相爱的人两个温暖的灵魂关注新冠肺炎热点精彩视频的微博视频
如果牠是第一位物類以消毒劑注射入體內以作抗新冠肺炎的測試的話只犧牲牠一位物類可讓全球多億人類带來和平及穩定在此多謝特朗普先生的偉大貢獻巴頓的微博视频
三部漫威新片改档·因为新冠疫情索尼和漫威合作的新蜘蛛侠即蜘蛛侠英雄归来和蜘蛛侠英雄远征续集档期推迟将由原定的年月日改为同年月日北美上映·而本月初才推迟到年月日北美上映的奇异博士奇异博士在疯狂多元宇宙中则再次推迟至年月
美国新冠肺炎确诊病例超万例特朗普签署近亿美元新纾困法案当地时间月日美国总统特朗普签署了价值近千亿美元的用于应对新冠肺炎疫情经济危机的新纾困法案特朗普签署亿美元援助法案央视网的微博视频
国际足联将向各国足协发放万美元作为运转经费中新网月日电当地时间日国际足联在官网宣布将立即为旗下个成员国协会发放和年的全额运转经费这意味着各国足协将收到万美元的经费加上此前国际足联一些尚未发放的经费本次国际足联发放的金额总计将达到亿万美元
关于公布年春季学期符合学生返校条件的初高中学校名单的通告经深圳市新冠肺炎疫情防控指挥部办公室学生返校工作专班审核全市个区的所初高中学校校区符合省市文件要求的学生返校条件同意以上学校符合健康条件的高三初三学生于月日返校学校名单详情如下
为防感染意大利设计在飞机座椅间加防飞沫板据韩国电视台报道为减小在飞机上感染新冠病毒的可能意大利一家公司提出一种新的座椅设计方案在座椅间加装保护板以降低空气中飞沫的传播让乘客比现在更加安全该方案正在论证中央视网中国舆论场的微博视频
蓬佩奥抹黑中国被国际舆论痛批蓬佩奥借湿货市场抹黑中国被国际舆论痛批美国国务卿蓬佩奥等政客声称要中国等国关闭野生动物湿货市场西方媒体近期也将湿货市场塑造成新冠病毒的代名词甚至以此制造刻板印象抹黑中国美国有线电视新闻网等媒体刊文介绍中国的农贸市场
美疫情或追溯至月根据报道美国最早的新冠感染者或在十二月就已经出现比想象中早非常多最近特朗普还把负责开发疫苗的科学家给开除了看看崔娃怎么集中火力开吐林允连线周星驰人人视频的微博视频
美疫情或追溯至月根据报道美国最早的新冠感染者或在十二月就已经出现比想象中早非常多最近特朗普还把负责开发疫苗的科学家给开除了看看崔娃怎么集中火力开吐林允连线周星驰人人视频的微博视频
对新冠抗体检测的检测菜搬运针对新冠的抗体检测现在市场上的各种产品可谓是雨后春笋百花齐放然而其中大部分没有经过审查前几天也发信提醒使用者能用于诊断的新冠抗体测试目前还不存在如果使用市场上现有的测试就要考虑到它们的局限性图和的研
罗斯福号航空母舰的全体人员已全部被检测了一遍核酸近人当中有人被新冠病毒感染感染率人住院重症率无人死亡机器人推荐作者签名本科学美文丛书网页链接伊雁声新书真实的我网页链接
盖茨称疫情尚未过半月日比尔·盖茨发布页文章将新冠疫情称为首个现代大流行病即现代社会第一场真正意义的大流行病此次疫情将重新定义这个时代未来两个月人们将进入半正常世界而且将持续较长时间直到大多数人口接种疫苗老板联播的微博视频
美国提示慎用特朗普推荐药物当地时间月日美国食品和药物管理局警告称不要随意使用被总统特朗普吹捧为治疗新冠病毒的潜在治疗方法的两种药物说羟氯喹和氯喹这两种药物由于可能产生严重的副作用因此只应在医院环境或临床试验中使用在使用该药物及阿奇霉素或其他
一起加油世卫组织启动国际合作项目加快疫苗研发当地时间月日世界卫生组织总干事谭德塞宣布启动获得抗击新冠肺炎工具加速器国际合作倡议加速新冠肺炎疫苗诊断和治疗工具的研发生产和公平分配只有团结一致才能遏制疫情确保科学和研究成果惠及每一个人中国日报网
美国累计确诊病例数超万美国约翰斯·霍普金斯大学发布的新冠肺炎疫情统计数据显示截至北京时间今天凌晨点分美国累计新冠肺炎确诊病例数超过万达到例死亡病例数超过万增至例第一时间的微博视频
陕西战疫情化危为机促发展奋力夺取双胜利丨第八十九场融媒体大直播今天月日陕西广播电视台继续直击全球疫情并邀请嘉宾走进演播室与网友互动答疑连线多路记者直播连线带来铁路部门有关高校学生票相关新规十四运丝路国际会议中心工程进展情况带您看看西安地铁五号线车体
日本据报道ブルノ・ケスター财团日发布的研究结果指出意大利首位新冠肺炎感染者可追溯到月份据悉两位中国游客在罗马确诊新冠后意大利于月日终止与中国的航班专家指出可能为时已晚另有专家指出在月份后半段意大利的疫情与中国无直接关系而是从德国传入日本疫情
陕西新增例境外输入病例均由莫斯科入境月日陕西卫健委发布通告称年月日时至日时陕西新增境外输入新冠肺炎确诊病例例其中例为无症状感染者转为确诊病例新增例境外输入性病例与月日日公布的例境外输入确诊病例属同一航班人员网页链接
每天早上醒来最关注的个问题各国领导人还健康吗有快死已死的吗美国新冠死多少人了增了多少例世界大战会爆发吗经济危机会爆发吗枕上书被删的集有生之年还能看到吗又是一个加班的周末
断供之后美国缺席世卫启动的全球倡议路透社世界卫生组织总干事谭德塞日宣布正式启动里程碑式的国际合作倡议以加速新冠肺炎相关疫苗诊断工具和治疗工具的研发生产和公平分配法国总统马克龙与欧盟委员会主席冯德莱恩等领导人参加了宣布这一计划的视频会议但美国表示不会
又是宅家隔离的一天继续游戏撸起来这次停摆海帅的游戏瘾应该是过足了啊微博篮球感恩季美国新冠肺炎确诊病例超万例凯尔特人记事簿的微博视频
广东全省高速今起恢复落杆通行仍免费从年月日零时起广东省高速公路将开展全路段全流程测试工作并实施常态化管理全省高速公路所有收费车道恢复落杆出口车道费显屏将显示当次通行的全程收费金额测试工作不会对车辆免费通行造成影响在宣布停止新冠肺炎疫情防控免收
陕西通报例境外输入确诊病例年月日时至日时陕西新增例境外输入病例其中例为无症状感染者转为确诊病例当前隔离密切接触者人新增例境外输入新冠肺炎确诊病例例无症状感染者与月日日公布的例境外输入确诊病例属同一航班人员于月日乘坐航班由
年初到现在一大批自动化工厂顺势做口罩机了跨界做口罩的工厂上半年的业绩都处于高速增长状态想起东莞某口罩供应链的老板二月还开着普通的宝马三月份换了一部三百万的车外贸老板坐公交车了美国新冠肺炎确诊超万例世界地球日
态度大变无端指责中国后蓬佩奥称要指望中国援助防疫物资美国国务卿蓬佩奥在日记者会上再次抹黑中国称中国隐瞒疫情并指责世卫组织但提到中国的防疫物资他的态度倒来了个大转弯英国每周从中国运约吨医疗物资特朗普建议注射消毒剂杀灭新冠病毒
全球疫情速报丨特朗普称建议注射消毒液是讽刺新冠病毒持续蔓延各国国家的疫情形势仍不容乐观美国总统特朗普签署第四轮经济刺激方案法国里尔市政厅变身临时工厂英国病毒检测网上预约系统因流量太大临时关闭后又开启日本东京都至少有名医护人员感染非洲疫情大暴
英国新冠疫情重大发现英国紧急科学委员会昨日开会后公布口罩能防止传播新冠病毒每日邮报报导英国人不久将被要求在工作商店和公共交通工具上佩戴口罩在公共场所戴口罩可能很快就会成为强制规定以阻止冠状病毒的传播研究称美新冠早期死亡被低估
东营身边事今天起山东高速公路恢复落杆通行为统筹新冠肺炎疫情防控和经济社会发展从月日零时起全国收费公路统一免收车辆通行费免费政策实施对促进疫情防控和复工复产发挥了重要作用为进一步规范高速公路运行管理切实保护广大人民群众生命财产安全并为恢复收费以后高速公路
陕西新增例境外输入病例均由莫斯科入境月日陕西卫健委发布通告称年月日时至日时陕西新增境外输入新冠肺炎确诊病例例其中例为无症状感染者转为确诊病例新增例境外输入性病例与月日日公布的例境外输入确诊病例属同一航班人员网页链接
每天早上醒来最关注的个问题各国领导人还健康吗有快死已死的吗美国新冠死多少人了增了多少例世界大战会爆发吗经济危机会爆发吗枕上书被删的集有生之年还能看到吗又是一个加班的周末
断供之后美国缺席世卫启动的全球倡议路透社世界卫生组织总干事谭德塞日宣布正式启动里程碑式的国际合作倡议以加速新冠肺炎相关疫苗诊断工具和治疗工具的研发生产和公平分配法国总统马克龙与欧盟委员会主席冯德莱恩等领导人参加了宣布这一计划的视频会议但美国表示不会
又是宅家隔离的一天继续游戏撸起来这次停摆海帅的游戏瘾应该是过足了啊微博篮球感恩季美国新冠肺炎确诊病例超万例凯尔特人记事簿的微博视频
陕西通报例境外输入确诊病例年月日时至日时陕西新增例境外输入病例其中例为无症状感染者转为确诊病例当前隔离密切接触者人新增例境外输入新冠肺炎确诊病例例无症状感染者与月日日公布的例境外输入确诊病例属同一航班人员于月日乘坐航班由
年初到现在一大批自动化工厂顺势做口罩机了跨界做口罩的工厂上半年的业绩都处于高速增长状态想起东莞某口罩供应链的老板二月还开着普通的宝马三月份换了一部三百万的车外贸老板坐公交车了美国新冠肺炎确诊超万例世界地球日
從不戴上口罩視眾的特朗普更稱以消毒劑注入人體可以抗新冠肺炎病毒以「牠」的邏輯思維相信「牠」每晚也來一杯消毒劑牠一人的貢獻更會積極為地球帶來和平穩定的希望而且全球人類都會熱烈支持牠
法国总统强调支援餐饮业军方向华购抗疟疾药法国新冠肺炎疫情严峻总统马克龙周五日跟餐饮业界代表开会业界表示希望能宽免今年税务免租半年以及补偿部分营运损失有报道指当局可能于月日批准餐厅等重新营业社交网站日前传出一条片段显示法国军方运载一批重公斤的抗疟疾药物
全球疫情速报丨特朗普称建议注射消毒液是讽刺新冠病毒持续蔓延各国国家的疫情形势仍不容乐观美国总统特朗普签署第四轮经济刺激方案法国里尔市政厅变身临时工厂英国病毒检测网上预约系统因流量太大临时关闭后又开启日本东京都至少有名医护人员感染非洲疫情大暴
英国新冠疫情重大发现英国紧急科学委员会昨日开会后公布口罩能防止传播新冠病毒每日邮报报导英国人不久将被要求在工作商店和公共交通工具上佩戴口罩在公共场所戴口罩可能很快就会成为强制规定以阻止冠状病毒的传播研究称美新冠早期死亡被低估
新冠病毒抗体检测拟纳入广州医保最高定价元项月日广州市医疗保障局发布广州市医疗保障局关于公开征求严重急性呼吸综合征冠状病毒抗体测定项目价格的通知征求意见稿意见的通告根据意见稿本次抗体测定项目名称为严重急性呼吸综合征冠状病毒抗体测定项目内涵包括
今晚看了下全球新冠疫情以外的新闻才发现大洋彼岸那事儿越来越严重了岁体重在几年里暴增公斤家族心肌梗塞历史肉食烟酒样样喜欢外地巡视中突发心脏病传说已成植物人
三部漫威新片改档三部漫威新片改档因新冠疫情影响新蜘蛛侠以及奇异博士和雷神纷纷改档蜘蛛侠由明年月日改为同年月日北美上映奇异博士由年月日再次推迟至年月日雷神爱与雷电推迟至年月月后稍微提前至同年月日
窃以为若说新冠肺炎真是场大考中国打热身赛欧美打上半场第三世界打下半场最后还得拉着中国回场打加时赛但这场大考中国人是闭卷的热身赛考得不错给了其他人开卷考的机会但不是所有人都珍惜
波士顿动力大黄狗参与战疫佩戴协助医生治疗月日据报道波士顿动力旗下四足机器人俗称大黄狗已经在波士顿一家医院协助治疗新冠病人它使用做屏幕帮助医生们与患者视频会议该公司计划扩展大黄狗使用范围在疫情期间协助更多医疗人员时间视频
滁州战疫行动安徽唯一境外输入确诊病例治愈出院月日下午我省唯一一例境外输入确诊病例从淮北市人民医院治愈出院月日安徽省报告例境外输入确诊病例经过十多天精心救治和悉心护理该患者已无新冠肺炎相关症状各项检查指标均恢复正常连续两次间隔小时新型冠状病毒核酸
禁食野生动物从你我做起北京全面禁止食用野生动物野生动物只应存在于广阔天地间而不是餐桌之上敬畏自然尊重生命保护野生动物就是保护我们自己珠峰的日出盛景小央视频的秒拍视频
杜兰特从新冠肺炎中痊愈康复就好好好养伤下赛季冲击总冠军吐槽大会体育迷失恋天
全国实际在运营降至家后续处置难度大新冠肺炎疫情给互联网金融和网络借贷整治工作带来新的挑战剩余在营机构三降工作进展缓慢停业机构退而不清退而难清问题突出转型面临许多困难全国实际在运营降至家后续处置难度大
纽约州长病毒从欧洲而非中国传入美国关前门却给病毒留后门纽约州长称该州病毒从欧洲传入纽约州州长科莫日在例行发布会上说调查显示就纽约州而言新冠病毒是从欧洲传入的而不是中国纽约州州长科莫新冠病毒不是从中国而是从欧洲传入纽约州的科莫说中国出现疫情
建议注射消毒液杀死病毒特朗普改口我不是医生特朗普称并不推荐美国人注射消毒液特朗普日暗示也许可以注射消毒液来抵御新冠病毒生产家用消毒剂的利洁时公司和高乐氏公司日相继发表声明警告用户不要使用消毒剂作为治疗剂特朗普日表示他前一天的讲话只是表达讽刺并不是要
美海军高官建议恢复罗斯福号舰长职务国防部长再考虑一下美国防部长回应恢复罗斯福号舰长职务建议剧情要反转美国罗斯福号航母前舰长布雷特•克罗泽因求助解决舰上疫情被解职后美国有线电视新闻网日报道称美国海军多名高级将领建议恢复克罗泽职务不过国防部长埃斯珀表
全球共抗疫情示威者在特朗普酒店外放假尸袋成千上万人因他的无能丧命当地时间日华盛顿特区的示威者在特朗普饭店外放置假尸袋并呼吁特朗普应为处理新冠病毒危机无能而辞职一位示威者说成千上万人因这位无能的总统而丧命全世界都想把他赶出去截至北京时间月日时分
全球疫情海外抗疫日记澳大利亚疫情美国疫情云游全世界全球各地的人们都在采取社交隔离措施来对抗新冠病毒的传播在这段视频中我们聚焦卫星数据从太空中观察大流行的影响让我们跟随把镜头拉回武汉开始的微博视频
美国新冠肺炎确诊病例超万例最新美国超万例中国以外确诊病例超过万例
参考微评生命至上是我们最大的坚守病毒凶恶环球同此凉热疫情一再证明大家都是受害者受害者们就应守望相助共克时艰在病魔面前生命至上应是我们最大的坚守无论是中国发往海外的数以十亿计口罩还是一批批远渡重洋的逆行者背后无一不承载着对生命的尊重对人道的捍卫
美国新冠肺炎确诊病例超万例特朗普=死亡群众的眼睛是雪亮的哎这是人类的悲哀日出东南隅的微博视频
索尼多部新片改档受新冠疫情影响索尼影业改档了旗下多部新片包括蜘蛛侠从原定的明年月日推迟到月日北美公映三部漫威新片改档蜘蛛侠平行宇宙从年月日推迟到月日其他改档作品荷兰弟联手马克·沃尔伯格新作神秘海域从明年月日提档至
美国食药局警告慎用特朗普推荐药物当地时间月日美国食品和药物管理局警告称不要随意使用被总统特朗普吹捧为治疗新冠病毒的潜在治疗方法的两种药物食药局说羟氯喹和氯喹这两种药物由于可能产生严重的副作用因此只应在医院环境或临床试验中使用食药局表示报告称在使用该药查看图片
网传玉环发现一例无症状患者为不实信息捉谣记日网上在传玉环发现一例无症状患者截至目前玉环市无新增新冠肺炎病例也未出现无症状感染者网传为不实信息请大家不造谣不信谣不传谣同时五一小长假临近也请广大市民朋友继续提高疫情防范意识做好自身保护措施浙江辟
很早就痊愈啦我号就发过消息啦朋友们杜兰特从新冠肺炎中痊愈杜兰特
一起加油世卫组织启动国际合作项目加快疫苗研发当地时间月日世界卫生组织总干事谭德塞宣布启动获得抗击新冠肺炎工具加速器国际合作倡议加速新冠肺炎疫苗诊断和治疗工具的研发生产和公平分配只有团结一致才能遏制疫情确保科学和研究成果惠及每一个人人民日报
部分中国公民在墨西哥转机被遣返大使馆紧急提醒中国驻墨西哥大使馆网站月日消息近日部分拟经墨西哥转机回国的中国公民从美国等地乘飞机抵达墨西哥城机场后因后续中转国家相关政策收紧被拒绝乘坐第二程航班在机场移民局短暂滞留后被遣返回出发地我馆紧急提醒拟从其他
月日上午作为全省第一支进驻新郑国际机场协助海关执行入境人员新冠肺炎防控任务的医疗队采样队·感控队河南省人民医院排查境外输入性病例工作队在圆满完成各项任务结束集中隔离观察后凯旋回到医院巾帼战队凯旋欢迎河南省人民医院工作队回家
