content,estimate
美国纽约公交地铁位员工死于新冠肺炎据美国纽约大都会交通局日证实自新冠疫情暴发以来纽约市的公交地铁系统已有名员工死于新冠肺炎纽约大都会交通局已采取措施如乘客不能从公交司机所在的前门上下车等保护司乘人员目前纽约州累计确诊病例超万是疫情重灾区
特朗普改口建议注射消毒液杀死病毒嘲讽你们这些假新闻月日特朗普在白宫公开澄清注射消毒剂治疗新冠言论他表示自己当时只是在嘲讽在记者的追问下他还表示提出体内注射就是为了嘲讽不友好的媒体记者特朗普一天前在记者会上称将消毒剂注入人体可治疗新冠
这怕不是个憨批曝光渣男就会让孩子学坏你家渣男是新冠吗吸一口就传染自己声讨渣男前夫的时候满城皆知冲在第一线到了别人这就讲大道理事不关己教育别人堪称又当又立的典型你让人家私底下说你咋不跟周扬青私底下说既然觉得是别人家的私事你出来发表什么意见
这怕不是个憨批曝光渣男就会让孩子学坏你家渣男是新冠吗吸一口就传染自己声讨渣男前夫的时候满城皆知冲在第一线到了别人这就讲大道理事不关己教育别人堪称又当又立的典型你让人家私底下说你咋不跟周扬青私底下说既然觉得是别人家的私事你出来发表什么意见
广东全省高速今起恢复落杆通行仍免费从年月日零时起广东省高速公路将开展全路段全流程测试工作并实施常态化管理全省高速公路所有收费车道恢复落杆出口车道费显屏将显示当次通行的全程收费金额测试工作不会对车辆免费通行造成影响在宣布停止新冠肺炎疫情防控免收
建议注射消毒液杀死新冠病毒身体注射消毒剂特朗普改口我不是医生美国总统特朗普日在白宫发布会上暗示也许可以注射消毒液来抵御新冠病毒此言一出立刻引起美国舆论哗然生产家用消毒剂的利洁时公司和高乐氏公司日相继发表声明警告用户不要使用消毒剂作为治疗剂称漂白剂和其他消毒
歌诗达大西洋号邮轮人确诊停泊在日本长崎的意大利船籍邮轮歌诗达大西洋号又有船员人被确诊感染新冠病毒累计确诊人这艘邮轮没有乘客共有名船员已经全部检测结束图片机翻希望日本这次有让他们好好隔离有迅速让他们下船否则这剩余的人也不知道是否假阴
小时之外根据报道美国最早的新冠感染者或在十二月就已经出现比想象中早非常多最近特朗普还把负责开发疫苗的科学家给开除了看看崔娃怎么集中火力开吐人人视频人人视频的微博视频
智享会直播｜从疫情看公共卫生应急管理体系的挑战和机遇新冠疫情是一场大考本次讲座将在梳理总结中国抗疫阶段性成果的基础上针对监测预警应急管理支撑保障等方面所存在的短板和弱项探讨强化国家公共卫生应急管理体系建设的科学有效路径每经智享会联合清华五道口由中国医学
印度原油宝事件印度警察的恶作剧火了印度警察将疫情期间违反禁足令的人关进了一辆载有新冠肺炎病人的救护车当音乐响起的时候挣扎开始了汇荆州的微博视频
国际足联发放亿美元补贴当地时间日国际足联官方宣布将向个国家和地区的足协发放总计亿美元财政补助帮助他们度过疫情的困难时期国际足联主席因凡蒂诺表示这只是财政扶持政策的第一步如果后续情况恶化可能组织进一步的干预政策中国新闻网关注新冠肺炎足球
世卫启动里程碑式国际合作世界卫生组织总干事谭德塞日宣布正式启动里程碑式的国际合作倡议以加速新冠肺炎相关疫苗诊断工具和治疗工具的研发生产和公平分配最终实现让全球所有人都可以获得应对新冠肺炎的相关工具世卫启动里程碑式国际合作应对新冠疫情央视网的微博视频
美国部分州准备着手解除限制美国新冠病毒感染病例超万美国死亡病例已超万例据美国约翰斯·霍普金斯大学新冠肺炎疫情实时监测系统显示截至美东时间日下午时分美国共有新冠病毒感染病例例其中包括死亡病例例与该系统约小时前的数据相比美国新增感染病例
你知道吗今天是法罗群岛旗帜日法罗群岛是受丹麦王国外部主权统辖的自治领土最近法罗群岛科学家改造了他的通常用于三文鱼检测的实验室并购买了必要设备和器材为法罗群岛的许多居民进行新冠病毒检测根据此前统计法罗群岛人口中有的居民都接受了
新冠治愈但有严重基础性疾病患者谢谢你呵护我一起跟随镜头回顾那些有温度的瞬间辽宁共青团的微博视频辽宁共青团的微博视频
广州隔离期间核酸转阳广州新增例外籍无症状感染者据广州卫健委月日时至时广州市无新增新冠肺炎确诊病例新增无症状感染者例该无症状感染者为岁外国籍男子从事贸易工作为近期一例外国籍感染者的密切接触者月日纳入集中隔离医学观察在集中隔离医学观察期间核酸转阳
從不戴上口罩視眾的特朗普更稱以消毒劑注入人體可以抗新冠肺炎病毒以「牠」的邏輯思維相信「牠」每晚也來一杯消毒劑牠一人的貢獻更會積極為地球帶來和平穩定的希望而且全球人類都會熱烈支持牠
蓬佩奥借湿货市场抹黑中国被国际舆论痛批蓬佩奥抹黑中国被国际舆论痛批美国国务卿蓬佩奥等政客声称要中国等国关闭野生动物湿货市场西方媒体近期也将湿货市场塑造成新冠病毒的代名词甚至以此制造刻板印象抹黑中国美国有线电视新闻网等媒体刊文介绍中国的农贸
国家卫健委武汉现有重症病例清零确诊病例多为常阳患者无需治疗月日随着最后一例重症患者新冠肺炎治愈武汉现有重症病例清零国家卫健委医政医管局监察专员焦雅辉介绍武汉现有确诊病例已降至人其中多人长期核酸不转阴为常阳患者常阳患者只是核酸一直不转阴但已无需治疗
纽约州长称该州病毒是从欧洲传入而不是中国并指责美国行动太慢科莫说中国出现疫情后美国发布针对中国的旅行禁令可对欧洲却继续敞开大门针对欧洲的旅行禁令直到月中旬才出台这相当于关上了前门却给病毒留下了后门科莫还指出美国应对疫情迟缓两个月的时间里几乎无所作
揭露新冠疫情谣言传播蒸汽治疗肤色免疫都是假的新冠病毒的虚假谣言被揭穿不会传播新冠病毒蒸汽吸入不能治愈疾病黑色肤色也不能防止感染病毒疫苗并没有研发出来现实调查员劝诫大家不要轻信谣言否则会带来更大危险全球视频大魔王的微博视频
美疫情或追溯至月死者没来过中国当地时间日美国加利福尼亚州圣克拉拉县卫生部门官员透露近日验尸官们解剖了三具遗体这三人生前皆出现过流感样症状分别于月日月日月日在家中死亡解剖发现这三名死者均感染了新冠病毒华盛顿邮报引述当地卫生负责人的表态报道说
我们与合作伙伴组织中国医疗防疫专家与黎巴嫩尼泊尔柬埔寨肯尼亚尼泊尔等国公益医疗政府部门等进行了多场新冠疫情防控远程培训交流与分享昨天与埃及的活动也取得了良好效果埃及前总理伊撒姆·沙拉夫先生通过视频致辞表示这场此次新冠疫情是全人类面临的前所未有的挑战所以也需要
特朗普发布会现身分钟后离开顾问说太多对大选不好月日特朗普召开每日疫情发布会但全程仅持续分钟月中旬以来发布会平均时长从分钟增至分钟特朗普的平均发言时间也从分钟延长到了分钟其顾问认为曝光过度让他的民意调查落后于对手拜登聚焦新冠肺炎疫情世面
朋友跟我提起来说因为新冠的事情看了很多她的视频我实在忍不住给她发了那段我最早开始喜欢看采访的契机我可太喜欢这种有意思的做作语气了哈哈哈哈哈哈哈按吃的发个风格的微博视频
美国国土安全部负责科学与技术的副部长昨晚在白宫记者会上表示研究显示新冠病毒在阳光直射和高湿度条件下死亡最快特朗普随即说假设我们以强光无论是紫外线还是非常强的光照射人体我想您说那还没有经过测试但是您要进行测试然后我就想说假设您将光线带入了体内
纽约公交地铁位员工死于新冠肺炎美国疫情为什么搞成这样我到现在没整明白
特朗普签署亿美元援助法案当地时间日特朗普签署了一项总额约亿美元的应对新冠疫情援助法案以增加对小企业贷款项目医院和新冠病毒检测机构的拨款特朗普在白宫举行的签署仪式上表示该法案有利于小企业有利于工人微天下的微博视频
联合国视频会议技术问题频出美国大使掉线视频画面卡壳在新冠疫情影响下联合国也开启了远程工作模式安理会远程开会然而技术问题频发一会儿有人咳嗽一会儿有人卡住一会儿有人掉线整个会议不得不多次中止联合国秘书长发言人称正在努力解决技术问题
牛津计划月底前生产万剂新冠肺炎疫情肆虐全球欧洲多国纷纷进行新型冠状病毒疫苗试验其中瑞士伯尔尼大学医院的免疫学专家巴赫曼表示月将会为疫苗进行临床试验可望月开始大量投产瑞士药物监管局表示正与多位科学家包括巴赫曼讨论疫苗研发问题发言人指今年内投产的预估属极为乐
同意将世界发展分为新冠前与新冠后前后差别与我研究有关的问题主要有四唯导向的增长主义进一步转向以人为本位的可持续发展大城市单中心发展转向分布式多中心的都市圈发展浪漫主义的全球化转向有安全底线的全球化民主非民主或姓社姓资的意识形态争论转向国家治理能力建设
特朗普签署亿美元援助法案当地时间日特朗普签署了一项总额约亿美元的应对新冠疫情援助法案以增加对小企业贷款项目医院和新冠病毒检测机构的拨款特朗普在白宫举行的签署仪式上表示该法案有利于小企业有利于工人微天下的微博视频
联合国视频会议技术问题频出美国大使掉线视频画面卡壳在新冠疫情影响下联合国也开启了远程工作模式安理会远程开会然而技术问题频发一会儿有人咳嗽一会儿有人卡住一会儿有人掉线整个会议不得不多次中止联合国秘书长发言人称正在努力解决技术问题
牛津计划月底前生产万剂新冠肺炎疫情肆虐全球欧洲多国纷纷进行新型冠状病毒疫苗试验其中瑞士伯尔尼大学医院的免疫学专家巴赫曼表示月将会为疫苗进行临床试验可望月开始大量投产瑞士药物监管局表示正与多位科学家包括巴赫曼讨论疫苗研发问题发言人指今年内投产的预估属极为乐
昌江黎族自治县第十五届人民代表大会第六次会议开幕月日上午昌江黎族自治县第十五届人民代表大会第六次会议开幕新时代赋予新使命新使命呼唤新作为今年是海南自由贸易港建设开局之年更是昌江全县上下积极应对新冠肺炎疫情冲击和影响全面落实经济社会发展各项任务的关键之年来自
每天早上醒来最关注的个问题各国领导人还健康吗有快死已死的吗美国新冠死多少人了增了多少例世界大战会爆发吗经济危机会爆发吗枕上书被删的集有生之年还能看到吗又是一个加班的周末
日区块链服务网络全球商用启动大会在北京隆重召开国家信息中心主任刘宇南表示热烈祝贺区块链服务网络商用正式启动目前区块链服务网络各项功能已趋于稳定同时还催生了公益慈善物品追溯电子发票等一批创新应用并已在今年新冠肺炎疫情防控中发挥了积极作用人民网
冲绳为防人群观赏剪掉万株百合日本疫情依然紧张为了防止人群聚集观赏冲绳县综合运动公园将公园里的株百合全部给剪了截至日晚日本新冠肺炎累计确诊病例例死亡例日本疫情微日本的微博视频
上海个人核酸检测预约火爆小时内出结果上海全力防控新型冠状病毒肺炎上海市卫健委月日发布消息称为支持企事业单位和学校复工复产复学满足社会需求上海市单位或个人可按照自愿自费原则在相关检测机构预约开展新冠病毒核酸检测网页链接
美迄今发现最早死亡病例出现在月日月美国或已出现疫情社区传播美国加州日前公布美国迄今发现的最早死于新冠肺炎的病例出现在月日这比此前美国报告的首个因新冠肺炎去世的病例要早约三周时间报道称这显示可能早在月美国就已经出现了社区传播目前加州正在加大对此前去世的人的
迄今为止新冠病毒大流行是对现代医疗系统最大的考验每个人都在关注着医疗产品的供应链呼吸机口罩手套防护服和消毒剂短缺对病患护理产生重大影响并阻碍防止病毒传播工作的进行在哥伦比亚许多公司已主动调整其生产线开始生产突发卫生事件所需的关键产品为了确保这些产品质量达
国际疫情新冠疫情导致全球移民汇款创新低世界银行本周发布一份报告显示新冠疫情的全球大流行将导致年国际移民汇款额骤降左右这将是近代史上最大的一次降幅报告显示移民汇款是发展中国家的一个重要收入来源新冠疫情引发的经济衰退影响了移民工资和就业预计低收入和中等收
美国累计确诊近万据约翰斯·霍普金斯大学数据截至美东时间日时分美国新冠肺炎累计确诊病例为例死亡例美国新冠肺炎死亡病例超万央视新闻
美海军驱逐舰暴发疫情人感染日据报道美海军基德号驱逐舰暴发新冠疫情已出现名感染者该舰被派往加勒比东太平洋地区执行任务五角大楼发言人表示第一位检测呈阳性的水手在出现症状时被带离舰上此后船上其他水手也被陆续检测出阳性央视军事的微博视频
中国日报如何看中国援助外国抗疫这个德国小哥讲得很到位那是先做好自己再帮助别人海外抗疫日记抗击新冠肺炎疫情已经进入了全球抗疫的阶段目前中国已向多国派出了专家组并提供相关医疗物资在中国工作了年的德国小哥马库斯说中国的援助之举让他想到乘飞机时常听到的安全广
纽约州长称病毒来自欧洲而非中国纽约州州长科莫日在记者发布会上表示调查显示就纽约州而言新冠病毒是从欧洲传入的而不是中国科莫表示发生疫情后对中国发布旅行禁令可对欧洲继续敞开大门针对欧洲的旅行禁令直到月初才出台小央视频央视网快看的微博视频
因为新冠疫情媒体时常提到严重急性呼吸综合征和中东呼吸综合征其中综合征屡屡被写成综合症这是不规范的
美国疫情美国医学科学家临床研究发现新冠病毒对年轻人和中年人的损害之一表现在会在他们体内产生血栓从而导致危及生命的中风有人至死都不知道是因为感染新冠引起的中风网页链接不要以为新冠只对老人危害大
美国疫情美国医学科学家临床研究发现新冠病毒对年轻人和中年人的损害之一表现在会在他们体内产生血栓从而导致危及生命的中风有人至死都不知道是因为感染新冠引起的中风网页链接不要以为新冠只对老人危害大
复工后如何预防新型冠状病毒肺炎据央视新闻湖北省人民政府副省长曹广晶表示武汉市第一类企业可以继续复工复产那么复工复产后在商场公共交通体育馆等公共场所的工作人员来说应该怎样做好工作场所预防如何做好自身防护呢戳视频↓↓公共场所如何做好自身防护
三部漫威新片改档受新冠影响漫威旗下部新片再次改档原定的年月日上映的蜘蛛侠改档同年月日而奇异博士再次推迟到年月日雷神爱与雷电则提前至年月日
施林平凡坚守使命必达在抗击新冠肺炎疫情的战斗中许多人不畏艰险冲锋在前用平凡的坚守传递着温暖与力量来自华蓝集团的施林与团队伙伴一起夜以继日投身广西小汤山医院改扩建用坚守诠释责任用奉献彰显担当抗疫行动广西抗击新冠肺炎广西卫视的微博视频
特朗普苹果库克预计经济将在疫情后型反转美国总统特朗普表示他周五与苹果蒂姆·库克沟通了新冠疫情和经济现状库克认为经济将走出型反转大幅下滑后紧跟大幅反弹苹果发言人并未立刻作出回应直击抗击新型冠状病毒肺炎疫情新浪
三部漫威新片改档·因为新冠疫情索尼和漫威合作的新蜘蛛侠即蜘蛛侠英雄归来和蜘蛛侠英雄远征续集档期推迟将由原定的年月日改为同年月日北美上映·而本月初才推迟到年月日北美上映的奇异博士奇异博士在疯狂多元宇宙中则再次推迟至年月
特朗普:中国新冠肺炎死亡率看起来太低其中道理他恐怕永远想象不到关注热门表哥观看更多热门视频热门表哥的微博视频
美墨加协定将于月日生效美国贸易代表莱特希泽在声明中说新冠疫情表明美国现在比以往任何时候都更应努力增加在北美的制造能力和投资美墨加协定生效是朝这方面努力的里程碑式成就美国贸易代表将继续努力确保美墨加协定顺利实施让美国工人和企业享受新协定的好处
美墨加协定将于月日生效美国贸易代表莱特希泽日通报美国国会加拿大和墨西哥已采取必要措施遵守美国-墨西哥-加拿大协定简称美墨加协定中的承诺该协定将于月日生效美国贸易代表办公室当天发表声明说在莱特希泽通报美国国会后美国成为通知其他各方已完成落实美
被记者追问注射消毒液一事特朗普不承认了我是为了讽刺当地时间日在白宫回应记者提问时美国总统改口称他此前建议注射消毒液来抗击新冠病毒的说法是在讽刺记者并解释称消毒液搓在手上会起作用记者追问但你是在请医学专家对此进行调查你是在讽刺他们吗特朗普称不不不
-在杜兰特大学最强一战年杜兰特在联盟锦标赛的决赛中得到了分篮板保罗也在现场观看你觉得这是不是他打得最好的一场比赛呢杜兰特从新冠肺炎中痊愈布鲁克林篮网-联盟的微博视频
美国威斯康星州上千人聚集抗议居家令延长当地时间日美国威斯康星州上千名抗议者聚集在州议会大厦门前抗议居家令延长至月日他们喊着拿着标语牌写着所有的工人都必不可少还有些人带着美国国旗和突击步枪截至日晚该州累计确诊例新冠病例人死亡
塞尔维亚说中国专家对我们至关重要[加油]在中国医疗专家组建议下塞尔维亚政府在多地建设方舱医院收治新冠肺炎患者中国专家指出医院临床区域划分不合理后院方根据建议重新布局整改塞尔维亚卫生部表示中国专家指出的所有问题我们都会努力解决感谢中国政府和人民
纽约公交地铁位员工死于新冠肺炎官宣月日恢复比赛距首位感染新冠选手曝光仅天就在四天前外媒报道素有生化人美称的次中量级选手莱曼-古德确诊为新冠肺炎他是首位新冠病毒阳性选手这也是古德为何退出的原因中国冠军张伟丽一度滞留美国两
心心妹儿说快讯禁食野生动物从你我做起北京全面禁止食用野生动物野生动物只应存在于广阔天地间而不是餐桌之上敬畏自然尊重生命保护野生动物就是保护我们自己保护自然保护生态小央视频的秒拍视频
微记全球战疫进行时半月谈疾控中心主任高福新冠疫苗九月或有望可以紧急使用高福称新冠疫苗九月有望紧急使用-:
开放金融市场的第一课学费有点贵原油宝多头爆仓芝加哥交易所总裁送了句话意味深长西方的金融运作已经有几百年了有资本主义的时候就有了那时候我们还在玩镖局要到国际市场去就要学习以人家的规则作为自己的运作规则绝不能以自己的规则说了算那样的话坑害的只能是我们的
甘肃女孩遭老师猥亵跳楼坠亡宣判两年这种人还能当老师吗不应该吊销教师证吗受害人的命不是命吗现在是怎么了对恶人宽容能换来女孩子那条命吗美国新冠肺炎确诊病例超万例看着这个数据一天天增加真的隔着屏幕都感到揪心疫情无国界希望赶紧好起来吧全世
给全国中小学校新学期加强心理健康教育的条指导建议来了当前新冠肺炎疫情防控形势持续向好各地中小学积极推进开学复课工作为更好帮助各地师生顺利适应新学期教育部中小学心理健康教育专家指导委员会向全国中小学校提出条指导建议包括开展开学复课衔接工作做好师生心理健康状况
纽约州长病毒从欧洲传入美国关前门却给病毒留后门纽约州长称美国应对疫情迟缓纽约州州长科莫日在例行发布会上说调查显示就纽约州而言新冠病毒是从欧洲传入的而不是中国科莫表示中国出现疫情后美国发布针对中国的旅行禁令可对欧洲却继续敞开大门此外科莫还指出
疫线特写三周旅行变成三个月什么时候能回国好想回家宁波人任谦月号出国旅行原计划三周后回国和家人共度元宵却因国内外接连爆发的疫情被迫漂流海外三个多月期间任谦遭遇了小区封闭入境被拒航班取消机场关闭等等风波滞留在土耳其进退维谷任谦坦言早上起床会觉
郑州小学月日开学郑州非高三初三开学时间郑州市教育局经郑州市新冠肺炎疫情防控领导小组研究并报河南省教育厅新冠肺炎疫情防控领导小组备案决定我市非高三初三年级开学时间如下①高一高二初一初二年级于月日开学②小学各年级于月日开学③幼儿园特殊教育学校及校外培
教育系统疫情防控攻坚重症堡垒东大人站好最后一班岗随着新冠肺炎疫情形势逐渐缓解来自全国各地的援鄂医疗队陆续撤离武汉但仍有一支专家团队作为国家专家督导组留守武汉东南大学附属中大医院的邱海波和潘纯就在至今仍坚守的专家之列今天跟教育小微一起来读两位专家攻坚重症堡垒
疫情小时全球共抗疫情美国纽约州长病毒从欧洲传入本地而非中国纽约州州长科莫近日表示新冠病毒是从欧洲传入的而不是中国中国出现疫情后美国发布针对中国的旅行禁令可对欧洲却继续敞开大门针对欧洲的旅行禁令直到月中旬才出台这相当于关上了前门却给病毒留下了后门
好像回到大院了给六层奶奶二层奶奶送油糕送虾片他们给姥姥送拿糕大烩菜送来送去第一次吃松花蛋最后的生石灰味道或者是熟石灰了不喜欢有个人给大舅打电话问有没有新冠疫苗大舅说去武汉赵终南山找他没用
聚焦西雅图华州有望近期把新冠病毒检测能力提升至倍美国侨报网的微博视频
诺奖得主称病毒源于武汉实验室意大利生命科学联合会发声针对法国诺贝医学家得主吕克·蒙塔尼耶声称新冠病毒为人工合成并从武汉实验室意外泄漏出来的言论近日意大利生命科学联合会在一份声明中指出这是完全错误且毫无根据的声明认为对新冠病毒基因序列的分析表明它是自然进化的而不
新华社美国早在月即出现新冠肺炎传播误诊流感外媒称新冠病毒早在月份已经在美国加利福尼亚州传播最早的死亡病例可能被误当作流感据路透社美国萨克拉门托月日报道美国加利福尼亚州一名县卫生官员当地时间日表示新冠病毒早在今年月就已经开始在加州传播比预想中早了好几个
诺奖得主称病毒源于武汉实验室意大利生命科学联合会发声针对法国诺贝医学家得主吕克·蒙塔尼耶声称新冠病毒为人工合成并从武汉实验室意外泄漏出来的言论近日意大利生命科学联合会在一份声明中指出这是完全错误且毫无根据的声明认为对新冠病毒基因序列的分析表明它是自然进化的而不
新华社美国早在月即出现新冠肺炎传播误诊流感外媒称新冠病毒早在月份已经在美国加利福尼亚州传播最早的死亡病例可能被误当作流感据路透社美国萨克拉门托月日报道美国加利福尼亚州一名县卫生官员当地时间日表示新冠病毒早在今年月就已经开始在加州传播比预想中早了好几个
注射消毒剂治疗新冠特朗普我的讽刺你们不懂日特朗普在疫情简报上称可以利用光和热或者注射消毒剂清理肺部治疗新冠肺炎震惊无数人日有记者再次提及这一问题特朗普说我只是带着讽刺的口吻问了你们这样的记者一个问题想看看会发生什么特朗普表示他说的是可以
美国部分州准备着手解除限制美国新冠病毒感染病例超万美国死亡病例已超万例你觉得美国疫情出现拐点了吗锦绣青羊的微博投票
