content,estimate
从近万降至清零回顾重症患者转危为安的动人瞬间据长江日报月日武汉最后一例新冠重症患者治愈实现清零从月中旬重症患者最高峰时的近万例到月日下降至两位数再到日清零武汉市湖北省乃至全国付出了艰苦努力一起回顾一个个患者与死神搏斗后的动人瞬间
联合国秘书长称新冠肺炎疫苗应人人可得长期以来全球公共产品没有得到足够重视和足够投入此次新冠大流行带来的重要教训就是对全球公共产品和医疗全民覆盖的支持程度不够各自为战尤其是为了利益或者其它各自为战实际上就是自相残杀
张文宏科普疫苗接种病毒克星来了张文宏医生解答我们是否需要接种新冠疫苗以及广大女性非常关心的疫苗是否需要打是打国产疫苗还是进口疫苗视频里都有详细解答哦👇南京多肉辣妹制躁社的微博视频
新冠病毒月份已在美国传播外媒新冠病毒早在月份已在美国加利福尼亚州传播据路透社美国萨克拉门托月日报道美国加利福尼亚州一名县卫生官员当地时间日表示新冠病毒早在今年月就已经开始在加州传播比预想中早了好几个星期早期死亡病例很可能被误认为是流感美国加州圣克拉拉县
全球在抗疫特朗普称质疑阳光抑制病毒的记者是假新闻美官员称阳光可杀死新冠病毒特朗普能否用光热治疗美国一名官员透露最近的一项研究表明新冠病毒在高温和潮湿的环境下将会难以生存特别是在阳光的直接照射之下病毒会死得更快他所说的内容立刻引起了特朗普的兴趣特朗普
韩国新冠肺炎新增确诊例累计例月日时至月日时韩国新增新冠肺炎确诊病例例累计确诊病例为例新增的例中境外输入例累计死亡病例为例文在寅政府的执行力有目共睹虽然前期防控漏过新天地教会大邱成重灾区大范围检测追踪病毒携带者阻断传染路
韩国新冠肺炎新增确诊例累计例月日时至月日时韩国新增新冠肺炎确诊病例例累计确诊病例为例新增的例中境外输入例累计死亡病例为例文在寅政府的执行力有目共睹虽然前期防控漏过新天地教会大邱成重灾区大范围检测追踪病毒携带者阻断传染路
参考微评生命至上是我们最大的坚守病毒凶恶环球同此凉热疫情一再证明大家都是受害者受害者们就应守望相助共克时艰在病魔面前生命至上应是我们最大的坚守无论是中国发往海外的数以十亿计口罩还是一批批远渡重洋的逆行者背后无一不承载着对生命的尊重对人道的捍卫
盖茨称新冠是首个现代大流行病盖茨称目前仅经历疫情三分之一月日比尔·盖茨发布页文章将新冠疫情称为首个现代大流行病即现代社会第一场真正意义的大流行病此次疫情将重新定义这个时代未来两个月人们将进入半正常世界而且将持续较长时间直到大多数人口接种疫苗
美国食药局警告慎用特朗普推荐药物当地时间月日美国食品和药物管理局警告称不要随意使用被总统特朗普吹捧为治疗新冠病毒的潜在治疗方法的两种药物食药局说羟氯喹和氯喹这两种药物由于可能产生严重的副作用因此只应在医院环境或临床试验中使用食药局表示报告称在使用该药查看图片
纽约州州长美国的新冠病毒不是从中国传入的而是从欧洲美国错失了两个月的防疫时间转自今日海峡胡东晨的微博视频
张文宏科普疫苗接种网络上有很多疫苗的宣传老百姓有没有必要都应该接种呢上海市新冠肺炎医疗救治专家组组长复旦大学附属华山医院感染科主任张文宏表示疫苗是非常复杂的问题社会有一个特点不发生风险的时候大家其实不会主动做让你主动采取一件对健康有意义的事情而风险在
美国深入调查流感新冠疫情早就开始美国加利福尼亚州圣克拉拉县卫生部门官员透露近日验尸官们解剖了三具遗体这三人生前皆出现过流感样症状分别于月日月日月日在家中死亡解剖发现这三名死者均感染了新冠病毒而且没有去过中国当地卫生部门负责人表示如果新冠病毒的潜伏期
美国纽约公交地铁位员工死于新冠肺炎据美国纽约大都会交通局日证实自新冠疫情暴发以来纽约市的公交地铁系统已有名员工死于新冠肺炎纽约大都会交通局已采取措施如乘客不能从公交司机所在的前门上下车等保护司乘人员目前纽约州累计确诊病例超万是疫情重灾区
上海战疫上海加油张文宏谈中西医结合抗疫有了中医思想我们能走得更远更好月日下午张文宏在中医药在新冠肺炎防治中的作用与传承创新发展研讨会上表示在上海的新冠肺炎救治工作中充分贯彻了中西医结合中西医并重在他看来中医不应拒绝科学的方法西医也不该拒绝中医药
对新冠抗体检测的检测菜搬运针对新冠的抗体检测现在市场上的各种产品可谓是雨后春笋百花齐放然而其中大部分没有经过审查前几天也发信提醒使用者能用于诊断的新冠抗体测试目前还不存在如果使用市场上现有的测试就要考虑到它们的局限性图和的研
床破总在新闻发布会上提到注入消毒水也许能对付新冠感染后消毒水生产商吓坏了赶紧发表声明任何情况下消费者万万不要注射食用其清洁消毒类产品但床破发言小时后纽约市有毒物品控制中心已接到了例与消毒剂和其他清洁剂有关的病例
建议注射消毒液杀死病毒特朗普改口我不是医生特朗普称并不推荐美国人注射消毒液特朗普日暗示也许可以注射消毒液来抵御新冠病毒生产家用消毒剂的利洁时公司和高乐氏公司日相继发表声明警告用户不要使用消毒剂作为治疗剂特朗普日表示他前一天的讲话只是表达讽刺并不是要
美国新冠肺炎确诊病例超万例特朗普签署近亿美元新纾困法案当地时间月日美国总统特朗普签署了价值近千亿美元的用于应对新冠肺炎疫情经济危机的新纾困法案特朗普签署亿美元援助法案央视网的微博视频
截至月日时河南省新型冠状病毒肺炎疫情最新情况年月日时-时我省无新增新冠肺炎确诊病例疑似病例截至月日时全省累计报告本地新冠肺炎确诊病例例其中死亡病例例累计出院病例例累计报告境外输入确诊病例例全部出院自月日起我省已累计追踪到
美国特朗普要失望了逆势加码巨头纷纷投资中国看好的是什么新冠肺炎疫情蔓延全球产业链和供应链受到巨大冲击引发了人们对于去全球化和产业链回流的担忧特朗普和蓬佩奥等人开始鼓吹产业链去中国化疫情真的会削弱中国市场的吸引力吗鼓动在华外资撤出的声音真
区块链服务网络正式商用启动日区块链服务网络全球商用启动大会在北京隆重召开国家信息中心主任刘宇南表示热烈祝贺区块链服务网络商用正式启动目前区块链服务网络各项功能已趋于稳定同时还催生了公益慈善物品追溯电子发票等一批创新应用并已在今年新冠肺炎
世卫启动里程碑式国际合作应对新冠疫情世界卫生组织总干事谭德塞日宣布正式启动里程碑式的国际合作倡议以加速新冠肺炎相关疫苗诊断工具和治疗工具的研发生产和公平分配最终实现让全球所有人都可以获得应对新冠肺炎的相关工具世卫组织启动国际合作项目加快疫苗研发
每天多具遗体巴西现万人坑埋葬遗体据美国月日报道巴西亚马孙州首府马瑙斯市内工作人员正在挖掘一个巨型的万人坑用来下葬因新冠肺炎死亡的患者遗体马瑙斯市市长表示受新冠病毒影响该市每天有多具尸体需要埋葬在疫情之前平均每天需要下葬的遗体仅为具左右棺
特朗普苹果库克预计经济将在疫情后型反转美国总统特朗普表示他周五与苹果蒂姆·库克沟通了新冠疫情和经济现状库克认为经济将走出型反转大幅下滑后紧跟大幅反弹苹果发言人并未立刻作出回应新浪财经
美国特朗普要失望了逆势加码巨头纷纷投资中国看好的是什么新冠肺炎疫情蔓延全球产业链和供应链受到巨大冲击引发了人们对于去全球化和产业链回流的担忧特朗普和蓬佩奥等人开始鼓吹产业链去中国化疫情真的会削弱中国市场的吸引力吗鼓动在华外资撤出的声音真
区块链服务网络正式商用启动日区块链服务网络全球商用启动大会在北京隆重召开国家信息中心主任刘宇南表示热烈祝贺区块链服务网络商用正式启动目前区块链服务网络各项功能已趋于稳定同时还催生了公益慈善物品追溯电子发票等一批创新应用并已在今年新冠肺炎
世卫启动里程碑式国际合作应对新冠疫情世界卫生组织总干事谭德塞日宣布正式启动里程碑式的国际合作倡议以加速新冠肺炎相关疫苗诊断工具和治疗工具的研发生产和公平分配最终实现让全球所有人都可以获得应对新冠肺炎的相关工具世卫组织启动国际合作项目加快疫苗研发
特朗普苹果库克预计经济将在疫情后型反转美国总统特朗普表示他周五与苹果蒂姆·库克沟通了新冠疫情和经济现状库克认为经济将走出型反转大幅下滑后紧跟大幅反弹苹果发言人并未立刻作出回应新浪财经
全国各地的专家都去支援牡丹江了没人会想到这座边境城市会成为新冠病毒新的风暴中心我只能遥祝一切都会好起来北京·珠市口巍姐的微博视频
[闲着干嘛呢获得韩国大赏综艺部门作品赏本月的赏综艺部门赏双喜临门]日据报道闲着干嘛呢节目获得了第届韩国大赏综艺部门的作品赏其次为了因新冠肺炎而无法前往现场观看演出的观众们以人文主义为背景制作的特别企划房间旮旯儿演唱会系列还获得
泰国星暹新闻泰国疫情清迈连续日无新增病例民众焦虑风险降低月日据泰国新闻网站报道目前泰国的新冠肺炎疫情在不断的好转日在清迈的新冠肺炎疫情通报会议上透露清迈府已经连续日无新增确诊病例累计确诊病例一直保持在例新增例治愈病例累计治愈病例例
意大利邮轮停靠日本后暴发集体感染确诊人数再增近人据日本电视台日报道停靠在日本长崎港的意大利籍邮轮歌诗达大西洋号新增近人感染新冠病毒截至日该邮轮有例新冠肺炎确诊病例日长崎县政府协助厚生劳动省派去的医生自卫队检测船上的约名船员发现新增例
国际足联将向各国足协发放万美元作为运转经费中新网月日电当地时间日国际足联在官网宣布将立即为旗下个成员国协会发放和年的全额运转经费这意味着各国足协将收到万美元的经费加上此前国际足联一些尚未发放的经费本次国际足联发放的金额总计将达到亿万美元
今晚看了下全球新冠疫情以外的新闻才发现大洋彼岸那事儿越来越严重了岁体重在几年里暴增公斤家族心肌梗塞历史肉食烟酒样样喜欢外地巡视中突发心脏病传说已成植物人
美国疫情美国新冠肺炎确诊病例号超过万特朗普在白宫签署防疫过渡法案时表示死亡人数仍在万以下是因为政府应对及时并再次力挺羟氯喹治疗新冠肺炎的效果特朗普还澄清他并未向公众推荐摄入消毒液只是在以讽刺口吻向记者问问题凤凰王又又的微博视频
山东高速出入口恢复落杆免费政策不变为统筹新冠肺炎疫情防控和经济社会发展从月日零时起全国收费公路统一免收车辆通行费免费政策实施对促进疫情防控和复工复产发挥了重要作用为进一步规范高速公路运行管理切实保护广大人民群众生命财产安全并为恢复收费以后高速公路有序高
新冠大疫是世纪大疫疫情中传出太多的世纪传奇经历过-年流感和新冠两次大疫的百岁老人生命的顽强故事已经广为人知月日在纽约长岛一位百岁老人去世他的传奇是生于年的孪生兄弟死于流感大疫百年后他死于新冠这位二战老兵身体一直不错虽然已百岁新冠爆发后常看新闻在出现咳嗽
印度的硬核防疫让违反禁令的人与假扮新冠肺炎的演员坐同个车上海热门资讯的微博视频
索尼多部新片改档受新冠疫情影响索尼影业改档了旗下多部新片包括蜘蛛侠从原定的明年月日推迟到月日北美公映三部漫威新片改档蜘蛛侠平行宇宙从年月日推迟到月日其他改档作品荷兰弟联手马克·沃尔伯格新作神秘海域从明年月日提档至
为我们增强了战胜疫情的能力和信心曼谷诗丽叻医院刚安装了中国公司提供的新冠肺炎人工智能辅助诊断系统新冠病毒检测效率大大提升泰国副总理兼公共卫生部长阿努廷近日在接受本报记者采访时表示以前泰国主要依赖核酸检测不但耗时长也容易造成医护人员感染现在只需将疑似病例的胸
印度新增例新冠肺炎确诊病例累计例印度卫生部官网最新数据显示截至当地时间日上午时北京时间时分印度全境共报告新冠肺炎确诊病例例其中治愈出院例死亡例数据显示过去小时内印度全境新增确诊病例例央视新闻
防抗新型冠状病毒感染的肺炎美国海军驱逐舰暴发疫情人确诊据美联社报道正在执行缉毒任务的美国海军基德号驱逐舰上出现了疫情目前已有例新冠病毒感染病例据报道该舰上大约有名人员最近被派往加入加勒比东太平洋海域打击非法毒品贩运的行动五角大楼发言人乔纳森·霍夫曼
关于新冠病毒肺炎的谣言我们一一辟谣比尔·盖茨基金会制造疫情清除人类消毒液浓度越高消毒效果越好这些谣言需警惕面对疫情不信谣不传谣科学防控从你我做起关注新型肺炎
又是游轮于二月下旬开始停靠在日本长崎市三菱重工长崎造船所香烧工厂进行维修的意大利游轮歌诗达大西洋号爆发新冠疫情自本月日一名船员确诊后陆续开始对船上所有船员进行检测昨天检测工作全部完成船上共名船员共人确诊目前人重症已送往急救歌诗达日本分社和日本厚生劳
新冠大疫是世纪大疫疫情中传出太多的世纪传奇经历过-年流感和新冠两次大疫的百岁老人生命的顽强故事已经广为人知月日在纽约长岛一位百岁老人去世他的传奇是生于年的孪生兄弟死于流感大疫百年后他死于新冠这位二战老兵身体一直不错虽然已百岁新冠爆发后常看新闻在出现咳嗽
印度的硬核防疫让违反禁令的人与假扮新冠肺炎的演员坐同个车上海热门资讯的微博视频
索尼多部新片改档受新冠疫情影响索尼影业改档了旗下多部新片包括蜘蛛侠从原定的明年月日推迟到月日北美公映三部漫威新片改档蜘蛛侠平行宇宙从年月日推迟到月日其他改档作品荷兰弟联手马克·沃尔伯格新作神秘海域从明年月日提档至
为我们增强了战胜疫情的能力和信心曼谷诗丽叻医院刚安装了中国公司提供的新冠肺炎人工智能辅助诊断系统新冠病毒检测效率大大提升泰国副总理兼公共卫生部长阿努廷近日在接受本报记者采访时表示以前泰国主要依赖核酸检测不但耗时长也容易造成医护人员感染现在只需将疑似病例的胸
印度新增例新冠肺炎确诊病例累计例印度卫生部官网最新数据显示截至当地时间日上午时北京时间时分印度全境共报告新冠肺炎确诊病例例其中治愈出院例死亡例数据显示过去小时内印度全境新增确诊病例例央视新闻
防抗新型冠状病毒感染的肺炎美国海军驱逐舰暴发疫情人确诊据美联社报道正在执行缉毒任务的美国海军基德号驱逐舰上出现了疫情目前已有例新冠病毒感染病例据报道该舰上大约有名人员最近被派往加入加勒比东太平洋海域打击非法毒品贩运的行动五角大楼发言人乔纳森·霍夫曼
关于新冠病毒肺炎的谣言我们一一辟谣比尔·盖茨基金会制造疫情清除人类消毒液浓度越高消毒效果越好这些谣言需警惕面对疫情不信谣不传谣科学防控从你我做起关注新型肺炎
又是游轮于二月下旬开始停靠在日本长崎市三菱重工长崎造船所香烧工厂进行维修的意大利游轮歌诗达大西洋号爆发新冠疫情自本月日一名船员确诊后陆续开始对船上所有船员进行检测昨天检测工作全部完成船上共名船员共人确诊目前人重症已送往急救歌诗达日本分社和日本厚生劳
抗疫奇才特朗普注射消毒剂治新冠我想到消毒剂能在一分钟内把病毒消灭我们有办法这样做吗通过把消毒剂注射到体内清洗病毒因为消毒剂进入肺部作用会很大白宫记者会上这样一个让人瞠目结舌的点子就出自特朗普马来西亚·槟城北京鲁戈的微博视频
三部漫威新片改档受新冠疫情影响索尼和漫威合作的新蜘蛛侠将由原定的年月日改为同年月日北美上映本月初才推迟到年月日北美上映的奇异博士再次推迟至年月日本月初推迟至年月月北美上映的雷神爱与雷电则提前至同年月日
纽约公交地铁位员工死于新冠肺炎美国疫情为什么搞成这样我到现在没整明白
小调查你出门戴口罩用几次今日新冠治愈但有严重基础性疾病患者热议蜀黍提醒疫情依然严峻复杂要高度警惕麻痹思想厌战情绪侥幸心理松劲心态否则将带来严重后果甚至前功尽弃张文宏科普疫苗接种柳州公安的微博投票
新闻报道马里兰州紧急事务局昨天接到多个电话都是咨询消毒剂治新冠的事吓得紧急事务局赶紧发声明澄清马上也发了声明这些都是因为懂王在白宫记者会上说注射消毒剂治疗新冠的事毕竟美国有亿人只要其中有十分之一人看了这个视频就有万受众那在高达万的样本中
三部漫威新片改档年将会有四部漫威电影而且都是硬货续集堪称神仙打架
纽约公交地铁位员工死于新冠肺炎官宣月日恢复比赛距首位感染新冠选手曝光仅天就在四天前外媒报道素有生化人美称的次中量级选手莱曼-古德确诊为新冠肺炎他是首位新冠病毒阳性选手这也是古德为何退出的原因中国冠军张伟丽一度滞留美国两
纽约州长病毒从欧洲而非中国传入纽约州长称该州病毒从欧洲传入纽约州州长科莫日在例行发布会上说调查显示就纽约州而言新冠病毒是从欧洲传入的而不是中国科莫说中国出现疫情后美国发布针对中国的旅行禁令可对欧洲却继续敞开大门针对欧洲的旅行禁令直到月中旬才出台这
三部漫威新片改档因为新冠疫情索尼和漫威合作的蜘蛛侠北美推迟到年月日上映原定是年月日奇异博士再次推迟至年月日此前推迟到年月日雷神爱与雷电北美最新定档年月日比原定的提前一周
印度新增例新冠肺炎确诊病例累计确诊例据央视印度卫生部官网最新数据显示截至当地时间日上午时北京时间时分印度全境共报告新冠肺炎确诊病例例其中治愈出院例死亡例数据显示过去小时内印度全境新增确诊病例例
联合国秘书长称新冠肺炎疫苗应人人可得人人可得成本谁负担全球还有几亿吃不饱饭的人饭都吃不起打得起疫苗如果病毒发生多重变异现在研制的疫苗已经应付不了将来病毒的变化又要怎么办
甬城万事通超话联合国秘书长新冠肺炎疫苗和诊疗工具应人人可得万事通新闻联合国秘书长古特雷斯日在关于加速新冠肺炎疫苗和诊疗工具研发生产分配的国际合作倡议视频会议上发表讲话强调新冠肺炎疫苗和诊疗工具应人人可得甬城辣评新华视点的秒拍视频
三部漫威新片改档受新冠疫情影响索尼和漫威合作的新蜘蛛侠将由原定的年月日改为同年月日北美上映本月初才推迟到年月日北美上映的奇异博士再次推迟至年月日本月初推迟至年月月北美上映的雷神爱与雷电则提前至同年月日
联合国秘书长称新冠肺炎疫苗应人人可得泰国航空的空乘空姐乘务员拍摄为全世界人民加油打气❤️的微博视频
张文宏科普疫苗接种张文宏称疫苗研发最快要年以后针对新冠病毒疫苗研发情况张文宏表示疫苗要做安全性和疗效的实验正常时间走完需要-年按照现在的做法最快也要年以后疫苗研制出来后还需要综合当时的疫情情况病死率高低疫苗防护作用强弱有无不良反应等多个因素考虑是否
三部漫威新片改档年将会有四部漫威电影而且都是硬货续集堪称神仙打架
我在北美看疫情美国疫情纽约新冠病人急诊画面曝光医生受访一班次宣布名病人死亡美国圣约瑟夫医院被围困超过一周其博士雷诺称这个噩梦已经带走了很多人的生命医疗中心工作人员超过人检测为阳性医院内的所有医护人员都在跟新冠病毒做殊死搏斗时差视频
参考微评生命至上是我们最大的坚守病毒凶恶环球同此凉热疫情一再证明大家都是受害者受害者们就应守望相助共克时艰在病魔面前生命至上应是我们最大的坚守无论是中国发往海外的数以十亿计口罩还是一批批远渡重洋的逆行者背后无一不承载着对生命的尊重对人道的捍卫
校园疫情防控知识问答新冠肺炎疫情牵动着你我的心防控疫情人人有责那么你知道冠状病毒的常见宿主有哪些嘛天津大学的微博投票
小北预告说说心理话之告别歧视新冠肺炎患者治愈出院本希望获得鲜花和温暖然而有些人等来的却是排挤和歧视歧视背后的成因有哪些如何消除湖北卫视月日:播出说说心理话之告别歧视敬请收看
特朗普的偏方土方应该不是祖传的他应该是创始人
特朗普改口建议注射消毒液杀死病毒嘲讽你们这些假新闻月日特朗普在白宫公开澄清注射消毒剂治疗新冠言论他表示自己当时只是在嘲讽在记者的追问下他还表示提出体内注射就是为了嘲讽不友好的媒体记者特朗普一天前在记者会上称将消毒剂注入人体可治疗新冠
全球在抗疫美成立特别委员会调查政府对疫情应对美众议院成立特别委员会调查政府疫情应对美国国会众议院周四就投票通过成立特别调查委员会以审查特朗普政府对新冠疫情的应对以及经济救助计划的执行情况包括政府对检测和隔离等问题的处理设备和医疗用品的分发等特朗普反应如何来看详
美国威斯康星州上千人聚集抗议居家令延长当地时间日美国威斯康星州上千名抗议者聚集在州议会大厦门前抗议居家令延长至月日他们喊着拿着标语牌写着所有的工人都必不可少还有些人带着美国国旗和突击步枪截至日晚该州累计确诊例新冠病例人死亡
联合国秘书长称新冠肺炎疫苗应人人可得长期以来全球公共产品没有得到足够重视和足够投入此次新冠大流行带来的重要教训就是对全球公共产品和医疗全民覆盖的支持程度不够各自为战尤其是为了利益或者其它各自为战实际上就是自相残杀
小北预告说说心理话之告别歧视新冠肺炎患者治愈出院本希望获得鲜花和温暖然而有些人等来的却是排挤和歧视歧视背后的成因有哪些如何消除湖北卫视月日:播出说说心理话之告别歧视敬请收看
张文宏科普成人应该打哪些疫苗张文宏医生表示每年冬季都会有流感的大暴发今年新冠的暴发再夹杂流感的暴发对老年人成年人都是极大的风险成年人应该打流感季节的疫苗青年女性在成年之前最好打预防宫颈癌的疫苗更多↓↓张文宏科普疫苗接种人民日报的微博视频
联合国视频会议技术问题频出美国大使掉线视频画面卡壳在新冠疫情影响下联合国也开启了远程工作模式安理会远程开会然而技术问题频发一会儿有人咳嗽一会儿有人卡住一会儿有人掉线整个会议不得不多次中止联合国秘书长发言人称正在努力解决技术问题
国家卫健委武汉现有确诊病例多为常阳患者已无需治疗在我看来需不需要治疗并不是重点很多新冠肺炎轻症患者即使不治疗也能自愈重点是这些常阳患者有没有传染性再次以慢性乙肝患者为例他们虽然不发病是携带者但慢性乙肝患者仍然具有传染性我相信新冠肺炎常阳患者也是一样仍
歌诗达大西洋号邮轮人确诊停泊在日本长崎的意大利船籍邮轮歌诗达大西洋号又有船员人被确诊感染新冠病毒累计确诊人这艘邮轮没有乘客共有名船员已经全部检测结束图片机翻希望日本这次有让他们好好隔离有迅速让他们下船否则这剩余的人也不知道是否假阴
