content,estimate
关注新型冠状病毒肺炎疫情广东最后一批援鄂战士如约回家共同战疫嫁给我吧昨天上午广州市第一人民医院援鄂医疗队队员周豪单膝跪地向女友张彦兑现出征时回来之时就是我求婚之时的诺言昨天广东省第二十二批援助湖北武汉应对新型冠状病毒感染肺炎疫情医疗队人
三部漫威新片改档受新冠肺炎疫情影响漫威的蜘蛛侠奇异博士雷神三部影片全部改档大家还要多等一段时间哦
美国众议院仪员在推特上列出中国赔偿清单索赔近万亿美元要求中国月底付清说这是对众议院通过亿美元的抗疫解困方案的补充美国新冠肺炎确诊病例超万例
纽约州长称该州病毒从欧洲传入纽约州州长科莫日说调查显示就纽约州而言新冠病毒是从欧洲传入的而不是中国中国出现疫情后美国发布针对中国的旅行禁令针对欧洲的旅行禁令直到月中旬才出台关上了前门却给病毒留下后门纽约州长称美国应对疫情迟缓两个月时间里几乎无所
新浪收到武汉市新冠肺炎疫情防控指挥部感谢信近日新浪公司收到了来自武汉市委宣传部武汉市新冠肺炎疫情防控指挥部宣传组的感谢信感谢信指出新浪充分发挥网络平台传播覆盖优势始终与主流媒体同频共振携手同行营造了强信心暖人心聚民心的良好舆论氛围展示了武汉人民坚韧不拔
权威发布月日安徽省报告新冠肺炎疫情情况年月日-时安徽省报告无新增本地确诊病例无新增本地疑似病例无新增境外输入确诊病例新增境外输入确诊病例治愈出院例淮北市截至月日时安徽省累计报告本地确诊病例例治愈出院例累计报告境外输入确诊病例例
沈阳发布家新冠病毒核酸检测医院名单为了更好地满足社会化新冠病毒核酸检测需求全力配合复工复学市疾病预防控制中心市第六人民医院等家医疗机构共同组建沈阳市新冠病毒核酸检测联合实验室共同承担全市新冠病毒核酸检测有偿服务工作检测遵循自愿自费原则检测费用由市民个人承担
今晚看了下全球新冠疫情以外的新闻才发现大洋彼岸那事儿越来越严重了岁体重在几年里暴增公斤家族心肌梗塞历史肉食烟酒样样喜欢外地巡视中突发心脏病传说已成植物人
一起加油世卫组织启动国际合作项目加快疫苗研发当地时间月日世界卫生组织总干事谭德塞宣布启动获得抗击新冠肺炎工具加速器国际合作倡议加速新冠肺炎疫苗诊断和治疗工具的研发生产和公平分配只有团结一致才能遏制疫情确保科学和研究成果惠及每一个人中国日报网
国家卫健委新冠治愈但有严重基础性疾病患者仍在治疗昨天武汉现有重症病例清零国家卫健委主任马晓伟接受央视专访时表示重症清零标志着武汉保卫战取得决定性胜利新冠肺炎的治疗结束后一些患有基础性疾病的患者正在武汉高水平医院进行专科治疗这方面已妥善安排总台央视记
国家卫健委武汉现有重症病例清零确诊病例多为常阳患者无需治疗月日随着最后一例重症患者新冠肺炎治愈武汉现有重症病例清零国家卫健委医政医管局监察专员焦雅辉介绍武汉现有确诊病例已降至人其中多人长期核酸不转阴为常阳患者常阳患者只是核酸一直不转阴但已无需治疗
大胆假设小心求证壹小寒:非洲猪瘟也有蹊跷太可怕了
美媒美国多数感染基因来自欧洲而非中国纽约州长称该州病毒从欧洲传入本周加州圣克拉拉郡卫生官员宣布新发现的与冠状病毒相关的死亡于月日比此前被认为是由美国首例死亡病例提前了三周赫古伊博士的团队以及西奈山医学院的另一个团队发现纽约大多数感染新冠病毒的基因都来自欧洲
美国死亡病例已超过万例纽约州长称该州病毒从欧洲传入而不是中国纽约州州长科莫说中国出现疫情后美国发布针对中国的旅行禁令可对欧洲却继续敞开大门针对欧洲的旅行禁令直到月中旬才出台这相当于关上了前门却给病毒留下了后门
这怕不是个憨批曝光渣男就会让孩子学坏你家渣男是新冠吗吸一口就传染自己声讨渣男前夫的时候满城皆知冲在第一线到了别人这就讲大道理事不关己教育别人堪称又当又立的典型你让人家私底下说你咋不跟周扬青私底下说既然觉得是别人家的私事你出来发表什么意见
山东高速公路恢复落杆通行月日山东省交通运输厅发布关于我省高速公路联网收费系统恢复常态化管理的通告为统筹新冠肺炎疫情防控和经济社会发展从月日零时起全国收费公路统一免收车辆通行费免费政策实施对促进疫情防控和复工复产发挥了重要作用为进一步规范高速公路运
南昌战疫歌曲背影正式上线新冠肺炎疫情发生后各行各业都为打赢这场疫情防控阻击战群策群力文艺界亦是如此由李革作词庄月作曲彭晨冰演唱南昌广播电视台精心制作的背影融入了诸多文艺工作者的心血七易其稿最终与大家见面了点击视频↓南昌广播电视台的微博视频
长春公交集团守护百姓出行多措并举全面战疫展现国企担当长春身边事新冠肺炎疫情发生后长春公交集团也在全力保障市民的出行安全疫情发生后我们在乘坐公共交通工具时能够感受到防控措施十分严格上车不仅要佩戴口罩还要扫码记录行程在一些车辆上还配有防护用品在这场没有硝
川普总统川普成疯普美国疫情川普提议用强紫外线照射人体治疗新冠注射消毒剂清洗肺部美国国土安全局科技司司长日在白宫简报会上称高温高湿能加速病毒死亡川普听取报告后提议也许可以采用强光照射人体和注射消毒剂洗肺的方式进行治疗遭记者怒斥其散播谣言川普反驳
新华社美国早在月即出现新冠肺炎传播误诊流感外媒称新冠病毒早在月份已经在美国加利福尼亚州传播最早的死亡病例可能被误当作流感据路透社美国萨克拉门托月日报道美国加利福尼亚州一名县卫生官员当地时间日表示新冠病毒早在今年月就已经开始在加州传播比预想中早了好几个
共同战疫我省月工业主要指标全面向好新闻联播降幅收窄指标向好新增长点显现成为一季度广东工业经济运行的关键词昨天下午广东省工信厅召开的一季度新闻通气会透露工业和信息业主要经济指标有所下滑但随着企业复工复产进程加快前期压抑的产能得到释放生产加快恢
关注新冠肺炎广州身边事详情公布广州名无症状感染者从事贸易工作在隔离期间核酸转阳月日时至时广州市无新增新冠肺炎确诊病例新增出院病例例截至月日时累计报告境外输入确诊病例例境外输入关联病例例累计出院例尚在院治疗例危重例重型例
美国新冠肺炎确诊病例超万例据约翰斯·霍普金斯大学数据截至美东时间日:美国新冠肺炎确诊病例为例死亡例央视美国累计确诊近万每日经济新闻法治四川
全球疫情美股美国纽约州长病毒从欧洲传入本地而非中国纽约州州长科莫日在例行发布会上说调查显示就纽约州而言新冠病毒是从欧洲传入的而不是中国美国纽约州长病毒从欧洲传入本地而非中国
震撼航拍艘油轮携万桶原油漂外海加利福尼亚长滩港出现惊人一幕艘油轮漂浮在海岸线旁油轮之所以停滞不前是因为驾驶和飞行的减少对石油需求已经下降石油开采工作依旧进行供大于求石油公司的储油空间被用尽只能暂存于油轮上据路透社报道美国官方政府数据显示截至
视频特朗普签署亿美元援助法案当地时间日特朗普签署了一项总额约亿美元的应对新冠疫情援助法案以增加对小企业贷款项目医院和新冠病毒检测机构的拨款特朗普在白宫举行的签署仪式上表示该法案有利于小企业有利于工人微天下的微博视频
日区块链服务网络全球商用启动大会在北京隆重召开国家信息中心主任刘宇南表示热烈祝贺区块链服务网络商用正式启动目前区块链服务网络各项功能已趋于稳定同时还催生了公益慈善物品追溯电子发票等一批创新应用并已在今年新冠肺炎疫情防控中发挥了积极作用人民网
美国提示慎用特朗普推荐药物当地时间月日美国食品和药物管理局警告称不要随意使用被总统特朗普吹捧为治疗新冠病毒的潜在治疗方法的两种药物说羟氯喹和氯喹这两种药物由于可能产生严重的副作用因此只应在医院环境或临床试验中使用在使用该药物及阿奇霉素或其他
從不戴上口罩視眾的特朗普更稱以消毒劑注入人體可以抗新冠肺炎病毒以「牠」的邏輯思維相信「牠」每晚也來一杯消毒劑牠一人的貢獻更會積極為地球帶來和平穩定的希望而且全球人類都會熱烈支持牠
宅在家隔离他们忽然收到一封邻居的来信在这次疫情中有户人家的妻子在月底确诊感染新冠肺炎患者的丈夫和孩子在家隔离不久他们收到了一封信亲爱的邻居疫情无情邻里有情你们虽然隔离在家但不用觉得孤独我们邻居们都在你们身边支持你们希望早日康复我们家小朋友问候你
没人信人类怎么进化语言文字出现后因为更容易骗傻子了人类明显进化更快了自信的眉毛:神奇竟然有人信来去之间:估计会有人发推说自己打消毒液治好了新冠骗红脖子上当
疫情小时月日荆州市新冠肺炎疫情情况截至年月日时全市无疑似病例累计追踪密切接触者人尚在接受医学观察人因存在县市向中心城区转院情况按最终收治医疗机构所在辖区统计全市新增无症状感染者例当日转确诊例解除隔离例尚在医学观察无症状感染者例
陕西通报例境外输入确诊详情年月日时至日时陕西新增例境外输入病例其中例为无症状感染者转为确诊病例当前隔离密切接触者人新增例境外输入新冠肺炎确诊病例例无症状感染者与月日日公布的例境外输入确诊病例属同一航班人员于月日乘坐航班由
特朗普签署亿美元援助法案应对新冠疫情美国总统特朗普日签署一项总额约亿美元的应对新冠疫情援助法案以增加对小企业贷款项目医院和新冠病毒检测机构的拨款特朗普在白宫举行的签署仪式上表示该法案有利于小企业有利于工人此前美国国会参众两院分别于日和
全球战疫进行时疾控中心主任高福新冠疫苗九月或有望可以紧急使用高福称新冠疫苗九月有望紧急使用-:
三部漫威新片改档受新冠疫情影响索尼和漫威合作的新蜘蛛侠将由原定的年月日改为同年月日北美上映奇异博士奇异博士在疯狂多元宇宙中则再次推迟至年月日同时雷神爱与雷电则稍微提前至年月日
美众议院设立机构审查特朗普政府抗疫工作参考消息网月日报道据路透社华盛顿月日报道民主党主导的美国国会众议院于当地时间周四批准成立一个特别调查委员会负责审查联邦政府的疫情应对工作报道称虽然遭到共和党人的反对但众议院当天仍通过了这项法案该委员会将被赋予
刷微博的速度跟不上瓜的产出速度屈楚萧黎梵王思聪阿水表哥特朗普建议注射消毒剂治疗新冠
-单机飞行表演队社交距离航展完整视频年世界各地航空秀因新冠疫情纷纷取消除了美国空军雷鸟和海军蓝天使飞行表演队合体声援医护人员在城市上空进行了之外本月号美国还搞了一个社交距离航展美国空军--单机飞行表演队等悉数参加线上直播飞行表演美国空
疫情小时湖北新增确诊病例例湖北新增无症状感染者例年月日时全省新增新冠肺炎确诊病例例无境外输入病例全省新增病亡例全省新增出院例其中武汉市例截至年月日时全省累计报告新冠肺炎确诊病例例其中武汉市例孝感市
治愈系企鹅散步猩猩玩泡泡疫情下动物园中小动物纷纷变成小淘气受新冠肺炎影响新加坡关闭所有景点小动物们有点寂寞了可爱的企鹅们开始走出自己的小天地去散步了淘气的猩猩也想要尝尝泡泡的味道漫天飞舞的泡泡原来这么好玩啊大熊猫凯凯和嘉嘉也很寂寞
每天早上醒来最关注的个问题各国领导人还健康吗有快死已死的吗美国新冠死多少人了增了多少例世界大战会爆发吗经济危机会爆发吗枕上书被删的集有生之年还能看到吗又是一个加班的周末
对新冠抗体检测的检测菜搬运针对新冠的抗体检测现在市场上的各种产品可谓是雨后春笋百花齐放然而其中大部分没有经过审查前几天也发信提醒使用者能用于诊断的新冠抗体测试目前还不存在如果使用市场上现有的测试就要考虑到它们的局限性图和的研
大胆假设小心求证壹小寒:非洲猪瘟也有蹊跷太可怕了
杜兰特从新冠肺炎中痊愈近日杜兰特的经纪人里奇-克莱曼谈到了的恢复情况克莱曼表示杜兰特一开始被检测感染了病毒之后他们都感到非常恐怖但杜兰特始终没有出现过症状目前已经痊愈微博篮球感恩季体育迷失恋天
疫情小时湖北新增确诊病例例湖北新增无症状感染者例年月日时全省新增新冠肺炎确诊病例例无境外输入病例全省新增病亡例全省新增出院例其中武汉市例截至年月日时全省累计报告新冠肺炎确诊病例例其中武汉市例孝感市
张文宏谈中西医结合抗疫有了中医思想我们能走得更远更好月日下午张文宏在中医药在新冠肺炎防治中的作用与传承创新发展研讨会上表示在上海的新冠肺炎救治工作中充分贯彻了中西医结合中西医并重在他看来中医不应拒绝科学的方法西医也不该拒绝中医药的融入张文宏说中西
国际疫情动态法国新冠死亡病例升至例法国卫生总署署长萨洛蒙日说法国累计新冠死亡病例例较前一日增加例萨洛蒙在当天举行的新闻发布会上说在所有死亡病例中医院死亡病例为例在过去小时内增加例包括失能老人养老院在内的社会医疗机构死亡病例为
宽窄观察超话武汉归零日国家卫健委新闻发言人米锋表示月日湖北现有确诊病例首次降至例以下连续天无新增确诊和疑似病例随着最后一例重症患者新冠肺炎治愈日武汉重症病例实现了清零
美国疫情川大统领说可以考虑注射消毒液来治疗新冠俺的心里笃定了许多瞧俺有充足的消毒液还都是名牌最不济可以跟这哥们儿学学扎针输液网页链接
我在北美看疫情美国疫情美国新增万人申领失业救济一图看懂失业人数达万相当于州劳动人口总和日美国劳工部门公布上周新增领取失业补助人数约万人过去周受新冠疫情影响失业总人数达万相当于美州劳动人口总和据彭博社推算美月失业率或达是年金
美国新冠病毒感染病例超万美国死亡病例已超万例据美国约翰斯·霍普金斯大学新冠肺炎疫情实时监测系统显示截至美东时间日下午时分美国共有新冠病毒感染病例例其中包括死亡病例例与该系统约小时前的数据相比美国新增感染病例例新增死亡病例例美国
平安微课堂诈骗手法不断更新防骗也要与时俱进[加油]近日公安部发布关于新冠肺炎疫情期间依法严厉打击跨境赌博和电信网络诈骗犯罪的通告为让大家结合热点认清诈骗套路警察姐姐带着她的散装防骗又来了遇到诈骗请你保持理智冷静清醒认清套路擦亮眼睛
朝阳提示朝阳学生家长新冠疫情返校防控知识要知晓↓↓↓朝阳教育朝阳复学进行时抗击疫情朝阳在行动北京朝阳的微博视频
语出惊人引祸端特朗普建议注射消毒剂杀灭新冠病毒特朗普改口称自己不是医生美国总统特朗普日在白宫发布会上暗示可以注射消毒液来抵御新冠病毒此言一出立网上对清洁产品的搜索量激增特朗普日改口称他的话并不是要推荐美国人注射消毒液我不是医生人们应该咨询医生彭博社称
星爵克里斯·帕拉特参演的美剧公园与游憩剧组重聚他们正在拍摄一部半小时的特别节目用于为美国抗击新冠病毒筹集资金来自综艺
聚焦北京北京全面禁止食用野生动物月日起施行北京市第十五届人大常委会第二十一次会议日表决通过了北京市野生动物保护管理条例结合北京市实际细化野生动物保护名录重要栖息地保护等制度建立健全危害预防猎捕人工繁育以及全面禁食滥食等监管制度条例自年月日起
美国海军驱逐舰暴发疫情美国海军基德号驱逐舰暴发新冠肺炎疫情人确诊美国五角大楼一名发言人日证实美国海军基德号驱逐舰暴发新冠肺炎疫情已有人检测结果呈阳性美国海军医疗小组正在进行接触者追踪并隔离可能被暴露的个人央视网快看的微博视频
敬请关注图说｜一图读懂推动抓项目稳投资增动能工作相关情况新冠肺炎疫情发生以来安徽省委省政府坚决贯彻落实党中央决策部署全省人民众志成城顽强拼搏经受住了疫情带来的考验复工复产逐步恢复常态生产生活秩序加快恢复经济社会运行逐步趋于正常经济社会基本面总体稳定
聚焦北京北京全面禁止食用野生动物月日起施行北京市第十五届人大常委会第二十一次会议日表决通过了北京市野生动物保护管理条例结合北京市实际细化野生动物保护名录重要栖息地保护等制度建立健全危害预防猎捕人工繁育以及全面禁食滥食等监管制度条例自年月日起
敬请关注图说｜一图读懂推动抓项目稳投资增动能工作相关情况新冠肺炎疫情发生以来安徽省委省政府坚决贯彻落实党中央决策部署全省人民众志成城顽强拼搏经受住了疫情带来的考验复工复产逐步恢复常态生产生活秩序加快恢复经济社会运行逐步趋于正常经济社会基本面总体稳定
泰国星暹新闻泰国疫情这个府率先解封允许商场购物中心等开始营业楠府府尹瓦拉吉公布表示自月日起允许楠府的各大购物中心大型零售商店及电器销售中心开始正常销售电器类产品同时也要继续按照自月日起开始实行的抗疫防疫措施做好相关疫情防控工作楠府是北部未出现新冠肺
内蒙古对所有入境人员隔离观察月日内蒙古发布关于进一步加强管控严防新冠肺炎疫情输入传播扩散的通知对所有入境人员包括经区内口岸和区外口岸入境我区一律实行天集中隔离医学观察天居家隔离医学观察次核酸检测次血清抗体检测的管控措施人民网
法国市政厅变身口罩工厂志愿者们在此疯狂赶制口罩月日法国里尔市政厅变身口罩生产车间数十名志愿者自月日起便在此缝制口罩预计每周能产出只口罩这些口罩将优先供应给医护人员作为日常用品使用目前法国有万人感染超过万人死亡聚焦新冠肺炎疫情世面
有一个山村来的丫鬟为了怀上龙少爷的小孩想尽办法靠近龙少爷最后把他目垂了如愿当上龙家少奶奶纽约公交地铁位员工死于新冠肺炎穿太宗时期的服饰演奏大话西游追剧喵喵匠的微博视频
陕西战疫情化危为机促发展奋力夺取双胜利丨第八十九场融媒体大直播今天月日陕西广播电视台继续直击全球疫情并邀请嘉宾走进演播室与网友互动答疑连线多路记者直播连线带来铁路部门有关高校学生票相关新规十四运丝路国际会议中心工程进展情况带您看看西安地铁五号线车
美海军高官建议恢复罗斯福号舰长职务国防部长再考虑一下美国防部长回应恢复罗斯福号舰长职务建议剧情要反转美国罗斯福号航母前舰长布雷特•克罗泽因求助解决舰上疫情被解职后美国有线电视新闻网日报道称美国海军多名高级将领建议恢复克罗泽职务不过国防部长埃斯珀表
比尔·盖茨真希望新冠疫情已经过半很可惜还没有日前比尔·盖茨明确表示他将此次大流行病视为噩梦和定义时代的事件其影响将持续多年一切恢复正常还需要一段时间我希望我能说疫情进程已经完成了一半但是我不这么认为盖茨认为美国距离大规模生产新冠病毒疫苗还有数月甚至数年的
截至目前美国新冠病毒感染者接近万例死亡病例突破万例就在这确诊和死亡病例持续增长之际特朗普先生再发惊人之语建议患者注射消毒剂来杀死新冠病毒此言一出舆论哗然专家称如果公众效仿会付出生命的代价更有网友调侃你先来还不如直接喝消毒液来总统一起干杯还有
美国海军驱逐舰暴发疫情据美联社报道正在执行缉毒任务的美国海军基德号驱逐舰上出现了疫情目前已有例新冠病毒感染病例据报道该舰上大约有名人员最近被派往加入加勒比东太平洋海域打击非法毒品贩运的行动五角大楼发言人乔纳森·霍夫曼称第一名船员出现症状后被带离了该舰随
特朗普否认说过注射消毒液此前民众网上大量搜索消毒液当地时间日在白宫回应记者提问时美国总统改口称他此前建议注射消毒液来抗击新冠病毒的说法是在讽刺记者此前特朗普在白宫发布会上暗示也许可以注射消毒液来抵御新冠病毒网上对清洁产品的搜索量激增生产家用消毒剂的
共同战疫张硕辅主持召开广州市委常委会会议部署推进常态化疫情防控和经济社会发展工作新闻联播昨天广州市召开市委常委会会议暨市防控新冠肺炎疫情工作领导小组指挥部和市推进企业项目复工复产工作领导小组会议广东省委常委广州市委书记领导小组组长张硕辅主持
疫情下香港中学文凭试开考考生和考场均做足防疫措施在香港新冠肺炎疫情持续放缓之下月日俗称香港高考的香港中学文凭试开考整个考期持续约一个月首日上午考试的科目是视觉艺术科约有名考生在疫情下赶赴考场应考为了防疫香港考评局及教育局实施了一系列防疫安排
盖茨称疫情尚未过半月日比尔·盖茨发布页文章将新冠疫情称为首个现代大流行病即现代社会第一场真正意义的大流行病此次疫情将重新定义这个时代未来两个月人们将进入半正常世界而且将持续较长时间直到大多数人口接种疫苗老板联播的微博视频
外交部郑重提醒新冠肺炎疫情在全球持续蔓延据世界卫生组织统计全球多个国家和地区报告确诊病例中国境外累计确诊病例多万例病亡多万例为防范疫情许多国家采取了加强出入境管控严格隔离等防疫政策措施国际航班大幅缩减一些国家与外界断航外交部郑重提醒在此
直播｜董明珠俞瑜孙洁等如何看待商业新变化新冠病毒已经把我们带到了一个新世界病毒侵蚀了人们之间的信任商界木兰们将以什么样的姿态进入新世界面对未来的不确定性她们又有什么样的思考和行动究竟视频的微博直播
世卫组织启动国际合作项目加快疫苗研发当地时间月日世界卫生组织总干事谭德塞宣布启动获得抗击新冠肺炎工具加速器国际合作倡议加速新冠肺炎疫苗诊断和治疗工具的研发生产和公平分配央视网快看的微博视频
新冠肺炎美国疫情实时动态全美确诊超万单日新增超万破历史新高死亡超万新泽西确诊超万美国海军驱逐舰暴发疫情美国疫情
索尼多部新片改档受新冠疫情影响索尼影业改档了旗下多部新片包括蜘蛛侠从原定的明年月日推迟到月日北美公映三部漫威新片改档蜘蛛侠平行宇宙从年月日推迟到月日其他改档作品荷兰弟联手马克·沃尔伯格新作神秘海域从明年月日提档至
今晚看了下全球新冠疫情以外的新闻才发现大洋彼岸那事儿越来越严重了岁体重在几年里暴增公斤家族心肌梗塞历史肉食烟酒样样喜欢外地巡视中突发心脏病传说已成植物人
三部漫威新片改档三部漫威新片改档因新冠疫情影响新蜘蛛侠以及奇异博士和雷神纷纷改档蜘蛛侠由明年月日改为同年月日北美上映奇异博士由年月日再次推迟至年月日雷神爱与雷电推迟至年月月后稍微提前至同年月日
窃以为若说新冠肺炎真是场大考中国打热身赛欧美打上半场第三世界打下半场最后还得拉着中国回场打加时赛但这场大考中国人是闭卷的热身赛考得不错给了其他人开卷考的机会但不是所有人都珍惜
美国新冠肺炎确诊病例超万例特朗普签署近亿美元新纾困法案当地时间月日美国总统特朗普签署了价值近千亿美元的用于应对新冠肺炎疫情经济危机的新纾困法案特朗普签署亿美元援助法案央视网的微博视频
